{
  "std": {
    "opt": "-std=",
    "val": "gnu99"
  },
  "CFLAGS": [
    "-O2",
    "-Wall",
    "-Wextra"
  ],
  "DEFINES": [
    "LUA_COMPAT_5_2",
    "LUA_USE_LINUX"
  ],
  "CMCFLAGS": [
    "-Os"
  ],
  "LINKFLAGS": [
    "-Wl,-export-dynamic"
  ],
  "libs": [
    "m",
    "dl",
    "edit"
  ]
}
