{
  "std": {
    "opt": "-std=",
    "val": "c99"
  },
  "CFLAGS": [
    "-O2",
    "-Wall",
    "-Wextra"
  ],
  "DEFINES": [
    "LUA_COMPAT_5_2",
    "LUA_USE_POSIX",
    "LUA_USE_DLOPEN"
  ],
  "CMCFLAGS": [
    "-Os"
  ],
  "LINKFLAGS": [
    "-Wl,-brtl,-bexpall"
  ],
  "libs": [
    "m",
    "dl"
  ]
}
